今回一番新しいバージョンのpostgresqlをインストールするため
まずhttp://yum.postgresql.org/9.3/redhat/rhel-6-x86_64/　にアクセスしてパッケージの名前を確かめる
依存関係が存在するため，下のコマンドと逆の順番でインストールしようとしたらエラーが表示され，
必要なパッケージ名が提示される．

# yum install http://yum.postgresql.org/9.3/redhat/rhel-6-x86_64/postgresql93-libs-9.3.5-1PGDG.rhel6.x86_64.rpm

# yum install http://yum.postgresql.org/9.3/redhat/rhel-6-x86_64/postgresql93-9.3.5-1PGDG.rhel6.x86_64.rpm

# yum install http://yum.postgresql.org/9.3/redhat/rhel-6-x86_64/postgresql93-server-9.3.5-1PGDG.rhel6.x86_64.rpm

# service postgresql-9.3 initdb

これでpostgresqlが初めて使えるようになる．

# psql --version
psql (PostgreSQL) 9.3.5

vagrant環境でインストール直後デフォルトのDBを一覧を表示したいとき, エラーが表示される
vagrant@localhost:~/Projects/Web-Programming/Postgresql$ psql -l
psql: FATAL:  role "vagrant" does not exist

なので，vagrantというユーザをpostgresqlに作成する
vagrant@localhost:~/Projects/Web-Programming/Postgresql$ sudo -u postgres createuser vagrant

これで $ psql -l コマンドでDBを表示できるようになる．


vagrantユーザーでpostgresデータベースに入って，now()関数を使って時間を表示させる
vagrant@localhost:~$ psql -d postgres -U vagrant
psql (9.3.5)
Type "help" for help.

postgres=> select now();
              now
-------------------------------
2014-07-26 16:12:48.878849+00
(1 row)


postgresユーザでログインして，vagrantユーザーにデータベースを作る権限を付与する．
vagrant@localhost:~$ sudo su - postgres
-bash-4.1$ psql
psql (9.3.5)
Type "help" for help.

postgres=# ALTER USER vagrant CREATEDB;
ALTER ROLE


blogappというDBにpostsという名前のテーブルをmyposts名前にへんこする
名前が変わってることは\dtで確認
blogapp=> alter table posts rename to myposts;
ALTER TABLE
blogapp=> \dt
List of relations
Schema |  Name   | Type  |  Owner
--------+---------+-------+---------
public | myposts | table | vagrant
(1 row)


postgresqlのデータの型に
realとserialは実数と連番


「id serial」などは一意に決まるものなので，primary keyとしてあげればOK
blogapp=> create table posts (
blogapp(> id serial primary key
blogapp(> );
CREATE TABLE


下の例では制約のcheckを使って，bodyの文字数は５以上でないと登録できないようにしている
blogapp=> create table posts (
blogapp(> body text check(length(body) > 5)
blogapp(> );
CREATE TABLE


下の例では制約のdefaultを使って，デフォルト値を設定する．
blogapp=> create table posts (
blogapp(> is_draft boolean default TRUE,
blogapp(> created timestamp default 'now'
blogapp(> );
CREATE TABLE

\xという拡張表示を使って，レコードを見やすくする．
もう一回\x を入れると，offにすることができる
blogapp=> \x
Expanded display is on.
blogapp=> select * from posts;
-[ RECORD 1 ]------------------------
is_draft | t
created  | 2014-07-26 16:51:37.056765


'_'(アンダーバー)はlikeの中に使われて，任意の一文字を表すことができる．


'order by'の後ろに複数のフィールドを指定することができる
select * from users order by team, score desc;
上の文だとteamの中にscoreを降順で並び替え，team自体は昇順で並び替える，


'offset'で開始行を指定することができる
select * from users limit 3 offset 3;
offsetは0番から始まるので，3を指定すると4番目のレコードから表示させる．


http://www.postgresqltutorial.com/load-postgresql-sample-database/
上のウェブサイトからサンプルdvdrental.tarをvagrantユーザの作ったdvdrentalDBに入れるときに権限がないと言われて,\duでしらべてみる
postgres=# \du
List of roles
Role name |                   Attributes                   | Member of
-----------+------------------------------------------------+-----------
postgres  | Superuser, Create role, Create DB, Replication | {}
vagrant   | Create DB                           | {}
wang      |

そしてvagrantユーザをsuperuserになってもらう
postgres=# alter role vagrant superuser;
ALTER ROLE

これでpg_storeを使って，dvdrental.tarをいれることができた
$ pg_restore -U vagrant -d dvdrental dvdrental.tar


paymentテーブルにcustomer_idごとにいくらお金を使っているかを集計してから
having を使って，その中にさらに150ドル以上がかかるcustomer_idを順番にリストアップする
dvdrental=#select customer_id, sum(amount) from payment group by customer_id having sum(amount) > 150 order sum;
customer_id |  sum
-------------+--------
         176 | 151.68
         550 | 151.69
         187 | 151.73
         372 | 152.68
         462 | 152.69
         468 | 154.66
         259 | 154.70
         373 | 156.66
         470 | 157.69
         469 | 158.65
         522 | 161.68
         403 | 162.67
         236 | 166.61
         410 | 167.62
         181 | 167.67
         459 | 183.63
         144 | 189.60
         137 | 191.62
         178 | 194.61
         526 | 208.58
         148 | 211.55
(21 rows)


下の句はlength関数を使って, actor_idごとにfirst_nameカラムの文字列の長さを表示させる．
dvdrental=#select actor_id, first_name, length(first_name) as first_name_length from actor;
actor_id | first_name  | first_name_length
----------+-------------+-------------------
1 | Penelope    |                 8
2 | Nick        |                 4
3 | Ed          |                 2
4 | Jennifer    |                 8


concat関数を使った，actorテーブルのfirst_nameとlast_nameの間にスペースで連結することができる．
dvdrental=#select concat(first_name, ' ', last_name) as name from actor;
         name
----------------------
 Penelope Guiness
 Nick Wahlberg
 Ed Chase
 Jennifer Davis
 Johnny Lollobrigida
 Bette Nicholson
......


substring関数を使って，last_nameカラムの一つ目の文字から，二つの文字だけを表示させる．
dvdrental=# select substring(last_name, 1, 2) as first_two_chars_of_last_name from actor;
first_two_chars_of_last_name
------------------------------
Gu
Wa
Ch
Da
Lo
......


random()関数を使って，1未満の数字を表示する
dvdrental=# select random();
random
-------------------
0.837772259488702
(1 row)

random()を利用して，ランダムのレコードを取り出すことができる
下の句は実行するたびにランダムにレコードを表示させる．
dvdrental=# select * from actor order by random() limit 1;


関数機能を使って，自作の関数を作る．actorテーブルに
レコードの総数を集計するtotalRecords関数を作って,
select totalRecord()で呼び出す

dvdrental=# create or replace function totalRecords()
returns integer as $total$
declare
	total integer;
begin
	select count(*) into total from actor;
	return total;
end;
$total$ language plpgsql;
CREATE FUNCTION
dvdrental=# select totalRecords();
 totalrecords
--------------
          200
(1 row)


update句の中に下のような書き方もできる
今のamountの上に10をプラスする．
dvdrental=# update payment set amount = amount+10.0 where payment_id = 17503;


テーブルにカラムを追加する
actorテーブルにfull_nameというカラムを追加して，このカラムの型は
varchar(255)にする
dvdrental=# alter table actor add full_name varchar(255);

actorテーブルのfull_nameカラムを削除する場合は
dvdrental=# alter table actor drop full_name;
ALTER TABLE

actorテーブルのfirst_nameカラムの名前をmy_nameに変更する場合は
dvdrental=# alter table actor rename first_name to my_name;

test_tableのdescriptionカラムのもとの型textをvarchar(255)に変更する
dvdrental=# alter table test_table alter description type varchar(255);


下の二つの文はテーブルとテーブルのカラムへコメントする
dvdrental=# comment on table actor is 'this is my table.';
dvdrental=# comment on column actor.first_name is 'this is the first name';


pg_database_sizeとpg_size_prettyはデータベースの大きさをはかる関数
dvdrental=# select pg_database_size('dvdrental');
pg_database_size
------------------
14772408
(1 row)

dvdrental=# select pg_size_pretty(pg_database_size('dvdrental'));
pg_size_pretty
----------------
14 MB
(1 row)


viewの作成
必要なビューを上手く設計して、プログラムコード負荷が少なくなるように する。
create view の as 句以降には，select 文の様々なパターンが指定できる．
下の文はaddressテーブルにphoneの入っていないレコードを出力
dvdrental=# create view address_without_phone as
dvdrental-# select * from address where phone = '';

\dvで作成したviewの一覧を出力
dvdrental=#\dv

viewを使用するときに
dvdrental=# select * from address_without_phone ;

viewを削除するときに
dvdrental=# drop view address_without_phone;
DROP VIEW
